{
  "$schema": "https://decentralised.art/collections/manifest.schema.json",
  "schema_version": "dcn-collection-manifest.v1",
  "collection": {
    "id": "core-collection.v1.draft",
    "name": "DCN Core Collection v1 (Draft)",
    "kind": "core",
    "status": "draft",
    "maintainer": "hypermusic-ai",
    "generated_at_utc": "2026-04-16T00:00:00Z"
  },
  "network": {
    "chain_name": "DCN Chain (prototype)",
    "chain_api_base_url": "https://api.decentralised.art/chain"
  },
  "publication_policy": {
    "solidity_version": ">=0.8.2 <0.9.0",
    "requires_source_publication": true,
    "requires_hash_verification": true,
    "naming_policy": "deployable names must use domain_operation_vN (Solidity-safe); canonical_id keeps domain.operation.vN",
    "snippet_contract_policy": "sol_src is exact Solidity function body injected by dcn-server wrapper; do not include pragma/import/contract/entrypoint declarations in sol_src",
    "test_name_policy": "experiments must use unique test_* names; core canonical ids are reserved for curated publication"
  },
  "items": {
    "transformations": [
      {
        "canonical_id": "util.identity.v1",
        "name": "util_identity_v1",
        "version": 1,
        "category": "utility",
        "args_count": 0,
        "sol_src": "return x;",
        "notes": "Pass-through primitive.",
        "deterministic": true,
        "deployment": {
          "deployed": false,
          "owner": null,
          "address": null,
          "published_name": null,
          "deployment_block": null
        },
        "hashes": {
          "sol_src_sha256": "e60029d4b20bd40867b918f40e470635464455a841c81596ab84ef66abdb064d"
        },
        "snippet_contract": {
          "kind": "function_body",
          "language": "solidity",
          "entrypoint": "run",
          "x_parameter_type": "uint32",
          "args_type": "uint32[] calldata",
          "return_type": "uint32",
          "arg_index_inference": "highest args[i] + 1",
          "forbidden_constructs": ["pragma ", "import ", "contract ", "function run("]
        },
        "backend_reference": {
          "repository": "dcn-server",
          "path": "src/pt/src/transformation.cpp",
          "symbol": "constructTransformationSolidityCode"
        }
      },
      {
        "canonical_id": "math.add.v1",
        "name": "math_add_v1",
        "version": 1,
        "category": "math",
        "args_count": 1,
        "sol_src": "return x + args[0];",
        "notes": "Addition primitive.",
        "deterministic": true,
        "deployment": {
          "deployed": false,
          "owner": null,
          "address": null,
          "published_name": null,
          "deployment_block": null
        },
        "hashes": {
          "sol_src_sha256": "1aaaffb88cd2d09c3f99e2b0536d83c978d0165be430149c5b9777fe7bd39e29"
        },
        "snippet_contract": {
          "kind": "function_body",
          "language": "solidity",
          "entrypoint": "run",
          "x_parameter_type": "uint32",
          "args_type": "uint32[] calldata",
          "return_type": "uint32",
          "arg_index_inference": "highest args[i] + 1",
          "forbidden_constructs": ["pragma ", "import ", "contract ", "function run("]
        },
        "backend_reference": {
          "repository": "dcn-server",
          "path": "src/pt/src/transformation.cpp",
          "symbol": "constructTransformationSolidityCode"
        }
      },
      {
        "canonical_id": "math.subtract.v1",
        "name": "math_subtract_v1",
        "version": 1,
        "category": "math",
        "args_count": 1,
        "sol_src": "return x - args[0];",
        "notes": "Subtraction primitive (reverts on uint32 underflow).",
        "deterministic": true,
        "deployment": {
          "deployed": false,
          "owner": null,
          "address": null,
          "published_name": null,
          "deployment_block": null
        },
        "hashes": {
          "sol_src_sha256": "52d540d91d0b882c3b18b2a1e35dfd32f39906ea26f509356a41f22ce5f922db"
        },
        "snippet_contract": {
          "kind": "function_body",
          "language": "solidity",
          "entrypoint": "run",
          "x_parameter_type": "uint32",
          "args_type": "uint32[] calldata",
          "return_type": "uint32",
          "arg_index_inference": "highest args[i] + 1",
          "forbidden_constructs": ["pragma ", "import ", "contract ", "function run("]
        },
        "backend_reference": {
          "repository": "dcn-server",
          "path": "src/pt/src/transformation.cpp",
          "symbol": "constructTransformationSolidityCode"
        }
      },
      {
        "canonical_id": "math.multiply.v1",
        "name": "math_multiply_v1",
        "version": 1,
        "category": "math",
        "args_count": 1,
        "sol_src": "return x * args[0];",
        "notes": "Multiplication primitive.",
        "deterministic": true,
        "deployment": {
          "deployed": false,
          "owner": null,
          "address": null,
          "published_name": null,
          "deployment_block": null
        },
        "hashes": {
          "sol_src_sha256": "f64b431f76f4c8f5a051a7552df544af922fe42d1ab8ea5c71af56a5ea6d368a"
        },
        "snippet_contract": {
          "kind": "function_body",
          "language": "solidity",
          "entrypoint": "run",
          "x_parameter_type": "uint32",
          "args_type": "uint32[] calldata",
          "return_type": "uint32",
          "arg_index_inference": "highest args[i] + 1",
          "forbidden_constructs": ["pragma ", "import ", "contract ", "function run("]
        },
        "backend_reference": {
          "repository": "dcn-server",
          "path": "src/pt/src/transformation.cpp",
          "symbol": "constructTransformationSolidityCode"
        }
      },
      {
        "canonical_id": "math.divide.v1",
        "name": "math_divide_v1",
        "version": 1,
        "category": "math",
        "args_count": 1,
        "sol_src": "require(args[0] != 0, \"division by zero\");\nreturn x / args[0];",
        "notes": "Integer division.",
        "deterministic": true,
        "deployment": {
          "deployed": false,
          "owner": null,
          "address": null,
          "published_name": null,
          "deployment_block": null
        },
        "hashes": {
          "sol_src_sha256": "3eb5dd69e38af27bd03cc616c52329d409a98c868a7a8040682da42e383b4fcf"
        },
        "snippet_contract": {
          "kind": "function_body",
          "language": "solidity",
          "entrypoint": "run",
          "x_parameter_type": "uint32",
          "args_type": "uint32[] calldata",
          "return_type": "uint32",
          "arg_index_inference": "highest args[i] + 1",
          "forbidden_constructs": ["pragma ", "import ", "contract ", "function run("]
        },
        "backend_reference": {
          "repository": "dcn-server",
          "path": "src/pt/src/transformation.cpp",
          "symbol": "constructTransformationSolidityCode"
        }
      },
      {
        "canonical_id": "math.modulo.v1",
        "name": "math_modulo_v1",
        "version": 1,
        "category": "math",
        "args_count": 1,
        "sol_src": "require(args[0] != 0, \"modulo by zero\");\nreturn x % args[0];",
        "notes": "Modulo primitive.",
        "deterministic": true,
        "deployment": {
          "deployed": false,
          "owner": null,
          "address": null,
          "published_name": null,
          "deployment_block": null
        },
        "hashes": {
          "sol_src_sha256": "4cc4e402342910b07d20700f9ec4d32818c3e956fb1317208defc0b0d9670ff7"
        },
        "snippet_contract": {
          "kind": "function_body",
          "language": "solidity",
          "entrypoint": "run",
          "x_parameter_type": "uint32",
          "args_type": "uint32[] calldata",
          "return_type": "uint32",
          "arg_index_inference": "highest args[i] + 1",
          "forbidden_constructs": ["pragma ", "import ", "contract ", "function run("]
        },
        "backend_reference": {
          "repository": "dcn-server",
          "path": "src/pt/src/transformation.cpp",
          "symbol": "constructTransformationSolidityCode"
        }
      },
      {
        "canonical_id": "math.power.v1",
        "name": "math_power_v1",
        "version": 1,
        "category": "math",
        "args_count": 1,
        "sol_src": "uint32 result = 1;\nfor (uint32 i = 0; i < args[0]; i++) {\n    result = result * x;\n}\nreturn result;",
        "notes": "Exponentiation by repeated multiplication.",
        "deterministic": true,
        "deployment": {
          "deployed": false,
          "owner": null,
          "address": null,
          "published_name": null,
          "deployment_block": null
        },
        "hashes": {
          "sol_src_sha256": "bf2e0121f971bf82fc2c22e5d22f7aed7238c0f418686926fa8d07c0ebb6add8"
        },
        "snippet_contract": {
          "kind": "function_body",
          "language": "solidity",
          "entrypoint": "run",
          "x_parameter_type": "uint32",
          "args_type": "uint32[] calldata",
          "return_type": "uint32",
          "arg_index_inference": "highest args[i] + 1",
          "forbidden_constructs": ["pragma ", "import ", "contract ", "function run("]
        },
        "backend_reference": {
          "repository": "dcn-server",
          "path": "src/pt/src/transformation.cpp",
          "symbol": "constructTransformationSolidityCode"
        }
      },
      {
        "canonical_id": "math.min.v1",
        "name": "math_min_v1",
        "version": 1,
        "category": "math",
        "args_count": 1,
        "sol_src": "return x < args[0] ? x : args[0];",
        "notes": "Minimum of x and arg0.",
        "deterministic": true,
        "deployment": {
          "deployed": false,
          "owner": null,